{
  "event_type": "email.sent",
  "entity_id": "msg_5c20de44",
  "tenant_id": "tnt_founder",
  "payload": {
    "thread_id": "thr_92ab17",
    "in_reply_to": "msg_0af31c8e",
    "subject": "Re: Q3 renewal",
    "to": [{ "name": "Dana Lee", "email": "dana@acme.com" }],
    "snippet": "Happy to extend the renewal…",
    "body": "Happy to extend the renewal — proposed Q3 numbers attached. Let's lock them Thursday.\n\nBest,\nFounder",
    "sent_at": "2026-06-14T09:40:00Z",
    "direction": "outbound"
  },
  "metadata": {
    "provider": "nylas",
    "grant_id": "grant_founder_gmail",
    "draft_id": "draft_b81f2a9c"
  }
}
